{
  "$schema": "https://json-schema.org/draft/2020-12/schema",
  "title": "RenderReportInput",
  "type": "object",
  "properties": {
    "title": {
      "type": "string"
    },
    "summary_line": {
      "type": "string"
    },
    "facts": {
      "type": "array",
      "items": {
        "type": "object",
        "properties": {
          "label": {
            "type": "string"
          },
          "value": {
            "type": "string"
          }
        },
        "required": ["label", "value"],
        "additionalProperties": false
      }
    },
    "sections": {
      "type": "array",
      "items": {
        "type": "object",
        "properties": {
          "title": {
            "type": "string"
          },
          "lines": {
            "type": "array",
            "items": {
              "type": "string"
            }
          }
        },
        "required": ["title", "lines"],
        "additionalProperties": false
      }
    }
  },
  "required": ["title", "summary_line"],
  "additionalProperties": false
}
